{
    "schema_version": "cpu-prefetch-stage17-fixed-phase-actions/4",
    "profile_id": "STAGE17-FIXED-PHASE-ACTIONS-v4",
    "protocol_version": "2.0.0-pre.3",
    "predecessor": {
        "path": "config/stage17/stage17-fixed-phase-actions-v3.json",
        "size_bytes": 7866,
        "sha256": "885d1d0af89ba64a6b67ec4bc6624c5cc4e9ca0cd16a0acfde77fccdf194f5e1"
    },
    "worker_role": "STAGE17_FIXED_ACTION_WORKER",
    "runtime_profile": "STAGE17-FIXED-ACTION-WORKER-v4",
    "actions": [
        {
            "ordinal": 1,
            "action_id": "Q15-R",
            "required_state": "PREFLIGHT_ACCEPTED",
            "required_resolution_ids": [
                "S17-EXT-001",
                "S17-EXT-002",
                "S17-EXT-003"
            ],
            "authorization_resolution_id": null,
            "runtime_source": "EXT002_EXT003_ACCEPTED_RUNTIME",
            "privileged": false,
            "calibration": false,
            "pilot": false,
            "requires_restoration": false,
            "permission_matrix": {
                "read_only_observation": true,
                "privileged_controls": false,
                "calibration": false,
                "pilot_execution": false,
                "measurement": false,
                "phase18": false
            },
            "outputs": [
                {
                    "role": "Q15_R_READ_ONLY_PRESTATE",
                    "schema_identity": "cpu-prefetch-stage17-q15-r-output/3",
                    "schema_path": "config/schemas/stage17-q15-r-output-v3.schema.json",
                    "cardinality": "EXACTLY_ONE",
                    "file_pattern": "q15-r-output-v3.json",
                    "media_type": "application/json"
                }
            ]
        },
        {
            "ordinal": 2,
            "action_id": "Q15-W",
            "required_state": "PREFLIGHT_ACCEPTED",
            "required_resolution_ids": [
                "S17-EXT-001",
                "S17-EXT-002",
                "S17-EXT-003",
                "S17-EXT-004"
            ],
            "authorization_resolution_id": null,
            "runtime_source": "EXT002_EXT003_ACCEPTED_RUNTIME",
            "privileged": true,
            "calibration": false,
            "pilot": false,
            "requires_restoration": true,
            "permission_matrix": {
                "read_only_observation": false,
                "privileged_controls": true,
                "calibration": false,
                "pilot_execution": false,
                "measurement": false,
                "phase18": false
            },
            "outputs": [
                {
                    "role": "Q15_W_TRANSACTION",
                    "schema_identity": "cpu-prefetch-stage17-q15-w-output/3",
                    "schema_path": "config/schemas/stage17-q15-w-output-v3.schema.json",
                    "cardinality": "EXACTLY_ONE",
                    "file_pattern": "q15-w-output-v3.json",
                    "media_type": "application/json"
                }
            ]
        },
        {
            "ordinal": 3,
            "action_id": "Q16a",
            "required_state": "READY_FOR_STAGE17_PHASE_AUTHORIZATION",
            "required_resolution_ids": [
                "S17-EXT-001",
                "S17-EXT-002",
                "S17-EXT-003",
                "S17-EXT-004",
                "S17-EXT-005",
                "S17-EXT-006"
            ],
            "authorization_resolution_id": null,
            "runtime_source": "EXT006_RELEASE_RUNTIME",
            "privileged": true,
            "calibration": true,
            "pilot": false,
            "requires_restoration": true,
            "permission_matrix": {
                "read_only_observation": false,
                "privileged_controls": true,
                "calibration": true,
                "pilot_execution": false,
                "measurement": false,
                "phase18": false
            },
            "outputs": [
                {
                    "role": "Q16A_RING_DISTANCE_CAPTURE",
                    "schema_identity": "cpu-prefetch-stage17-q16a-output/3",
                    "schema_path": "config/schemas/stage17-q16a-output-v3.schema.json",
                    "cardinality": "PER_RUN",
                    "file_pattern": "q16a-c*-r*-output-v3.json",
                    "media_type": "application/json"
                },
                {
                    "role": "Q16A_RING_DEMAND_TRACE",
                    "schema_identity": "cpu-prefetch-stage17-q16a-trace/3",
                    "schema_path": "config/schemas/stage17-q16a-trace-v3.schema.json",
                    "cardinality": "PER_RUN",
                    "file_pattern": "q16a-c*-r*-trace-v3.json",
                    "media_type": "application/json"
                },
                {
                    "role": "STAGE17_CALIBRATION_HARDWARE_STATE",
                    "schema_identity": "cpu-prefetch-stage17-calibration-hardware-state/1",
                    "schema_path": "config/schemas/stage17-calibration-hardware-state-v1.schema.json",
                    "cardinality": "EXACTLY_ONE",
                    "file_pattern": "stage17-Q16a-hardware-state-v1.json",
                    "media_type": "application/json"
                }
            ]
        },
        {
            "ordinal": 4,
            "action_id": "Q16b",
            "required_state": "READY_FOR_STAGE17_PHASE_AUTHORIZATION",
            "required_resolution_ids": [
                "S17-EXT-001",
                "S17-EXT-002",
                "S17-EXT-003",
                "S17-EXT-004",
                "S17-EXT-005",
                "S17-EXT-006"
            ],
            "authorization_resolution_id": null,
            "runtime_source": "EXT006_RELEASE_RUNTIME",
            "privileged": true,
            "calibration": true,
            "pilot": false,
            "requires_restoration": true,
            "permission_matrix": {
                "read_only_observation": false,
                "privileged_controls": true,
                "calibration": true,
                "pilot_execution": false,
                "measurement": false,
                "phase18": false
            },
            "outputs": [
                {
                    "role": "Q16B_RUN_ARTIFACT_FAMILY",
                    "schema_identity": "cpu-prefetch-stage17-run-artifact-family/3",
                    "schema_path": "config/schemas/stage17-run-output-v3.schema.json",
                    "cardinality": "EXACTLY_ONE",
                    "file_pattern": "q16b-*",
                    "media_type": "application/octet-stream"
                },
                {
                    "role": "STAGE17_CALIBRATION_HARDWARE_STATE",
                    "schema_identity": "cpu-prefetch-stage17-calibration-hardware-state/1",
                    "schema_path": "config/schemas/stage17-calibration-hardware-state-v1.schema.json",
                    "cardinality": "EXACTLY_ONE",
                    "file_pattern": "stage17-Q16b-hardware-state-v1.json",
                    "media_type": "application/json"
                }
            ]
        },
        {
            "ordinal": 5,
            "action_id": "Q16c",
            "required_state": "READY_FOR_STAGE17_PHASE_AUTHORIZATION",
            "required_resolution_ids": [
                "S17-EXT-001",
                "S17-EXT-002",
                "S17-EXT-003",
                "S17-EXT-004",
                "S17-EXT-005",
                "S17-EXT-006"
            ],
            "authorization_resolution_id": null,
            "runtime_source": "EXT006_RELEASE_RUNTIME",
            "privileged": true,
            "calibration": true,
            "pilot": false,
            "requires_restoration": true,
            "permission_matrix": {
                "read_only_observation": false,
                "privileged_controls": true,
                "calibration": true,
                "pilot_execution": false,
                "measurement": false,
                "phase18": false
            },
            "outputs": [
                {
                    "role": "Q16C_RUN_ARTIFACT_FAMILY",
                    "schema_identity": "cpu-prefetch-stage17-run-artifact-family/3",
                    "schema_path": "config/schemas/stage17-run-output-v3.schema.json",
                    "cardinality": "EXACTLY_ONE",
                    "file_pattern": "q16c-*",
                    "media_type": "application/octet-stream"
                },
                {
                    "role": "STAGE17_CALIBRATION_HARDWARE_STATE",
                    "schema_identity": "cpu-prefetch-stage17-calibration-hardware-state/1",
                    "schema_path": "config/schemas/stage17-calibration-hardware-state-v1.schema.json",
                    "cardinality": "EXACTLY_ONE",
                    "file_pattern": "stage17-Q16c-hardware-state-v1.json",
                    "media_type": "application/json"
                }
            ]
        },
        {
            "ordinal": 6,
            "action_id": "STAGE17-BLINDED-PILOT",
            "required_state": "READY_FOR_STAGE17_PHASE_AUTHORIZATION",
            "required_resolution_ids": [
                "S17-EXT-001",
                "S17-EXT-002",
                "S17-EXT-003",
                "S17-EXT-004",
                "S17-EXT-005",
                "S17-EXT-006",
                "S17-EXT-007",
                "S17-EXT-008",
                "S17-EXT-009"
            ],
            "authorization_resolution_id": "S17-EXT-010",
            "runtime_source": "EXT006_RELEASE_RUNTIME",
            "privileged": true,
            "calibration": false,
            "pilot": true,
            "requires_restoration": true,
            "permission_matrix": {
                "read_only_observation": false,
                "privileged_controls": true,
                "calibration": false,